keys,en,es
Text/66/text,Give me a moment I'm getting some pictures for my blog,Dame chance estoy consiguiendo algunas fotos para mi blog
Text/67/text,it's a blog about reports on aliens and the paranormal,es un blog de reportajes sobre alienigenas y lo paranormal
Text/68/text,You should follow me on Paranormalgram my user is @rigo_el_paranormal2,Deberías de seguirme en el paranorgram mi user es @rigo_el_paranormal2
Text/69/text,I don't really post that often but still so you can get a notification,realmente no subo tan seguido pero igual para que te llegue notificación cuando saque algo nuevo
Text/6a/text,I'm currently working with some guys who have really good photos,es que estoy trabajando ahorita con unos weyes que traen muy buenas fotos
Text/6b/text,"Well, are you moving?", "Bueno, ¿si te mueves?"
